<Materials xmlns:xsi="http://www.w3.org/2001/XMLSchema-instance"
        xsi:noNamespaceSchemaLocation="Materials.xsd">
	<Version>1</Version>
    <Material>
        <UUID>8dd145d0-5f30-11ea-bc55-0242ac130003</UUID>
        <Name>Laminated panel</Name>
        <Protected>true</Protected>
        <Color>0x008054</Color>
        <Solid>
            <HygroThermal>
                <DefaultThickness>0.01</DefaultThickness>
                <MaterialInformation>NA</MaterialInformation>
                <BulkDensity>450</BulkDensity>
                <Porosity>0.55</Porosity>
                <SpecificHeatCapacityDry>1400</SpecificHeatCapacityDry>
                <ThermalConductivityDry>0.125</ThermalConductivityDry>
                <WaterVaporDiffusionResistanceFactor>203</WaterVaporDiffusionResistanceFactor>
                <MoistureStorageFunction>
                    <TableValue>
                        <x>0</x>
                        <y>0</y>
                    </TableValue>
                    <TableValue>
                        <x>0.1</x>
                        <y>37</y>
                    </TableValue>
                    <TableValue>
                        <x>0.3</x>
                        <y>45</y>
                    </TableValue>
                    <TableValue>
                        <x>0.5</x>
                        <y>53</y>
                    </TableValue>
                    <TableValue>
                        <x>0.7</x>
                        <y>64</y>
                    </TableValue>
                    <TableValue>
                        <x>0.8</x>
                        <y>73</y>
                    </TableValue>
                    <TableValue>
                        <x>0.9</x>
                        <y>89</y>
                    </TableValue>
                    <TableValue>
                        <x>0.93</x>
                        <y>98</y>
                    </TableValue>
                    <TableValue>
                        <x>0.95</x>
                        <y>107</y>
                    </TableValue>
                    <TableValue>
                        <x>0.99</x>
                        <y>159</y>
                    </TableValue>
                    <TableValue>
                        <x>0.995</x>
                        <y>185</y>
                    </TableValue>
                    <TableValue>
                        <x>0.999</x>
                        <y>251</y>
                    </TableValue>
                    <TableValue>
                        <x>0.9995</x>
                        <y>281</y>
                    </TableValue>
                    <TableValue>
                        <x>0.9999</x>
                        <y>347</y>
                    </TableValue>
                    <TableValue>
                        <x>1</x>
                        <y>534</y>
                    </TableValue>
                </MoistureStorageFunction>
                <LiquidTransportationCoefficientSuction>
                    <TableValue>
                        <x>0</x>
                        <y>0</y>
                    </TableValue>
                    <TableValue>
                        <x>73</x>
                        <y>4e-12</y>
                    </TableValue>
                    <TableValue>
                        <x>534</x>
                        <y>5e-12</y>
                    </TableValue>
                </LiquidTransportationCoefficientSuction>
                <LiquidTransportationCoefficientRedistribution>
                    <TableValue>
                        <x>0</x>
                        <y>0</y>
                    </TableValue>
                    <TableValue>
                        <x>57</x>
                        <y>5.2e-11</y>
                    </TableValue>
                    <TableValue>
                        <x>65</x>
                        <y>7e-11</y>
                    </TableValue>
                    <TableValue>
                        <x>534</x>
                        <y>1e-10</y>
                    </TableValue>
                </LiquidTransportationCoefficientRedistribution>
                <ThermalConductivityMoistureDependent>
                    <TableValue>
                        <x>0</x>
                        <y>0.12</y>
                    </TableValue>
                    <TableValue>
                        <x>534</x>
                        <y>0.12</y>
                    </TableValue>
                </ThermalConductivityMoistureDependent>
                <ThermalConductivityTemperatureDependent>
                    <TableValue>
                        <x>10</x>
                        <y>0.12</y>
                    </TableValue>
                </ThermalConductivityTemperatureDependent>
            </HygroThermal>
            <Optical>
                <Integrated>
                    <Infrared>
                        <Transmittance>0</Transmittance>
                        <Emissivity-Front>0.9</Emissivity-Front>
                        <Emissivity-Back>0.9</Emissivity-Back>
                    </Infrared>
                </Integrated>
            </Optical>
        </Solid>
    </Material>
    <Material>
        <UUID>8dd149b8-5f30-11ea-bc55-0242ac130003</UUID>
        <Name>Aerated Concrete</Name>
        <Protected>true</Protected>
        <Color>0xFF8080</Color>
        <Solid>
            <HygroThermal>
                <DefaultThickness>0.2</DefaultThickness>
                <MaterialInformation>NA</MaterialInformation>
                <BulkDensity>400</BulkDensity>
                <Porosity>0.81</Porosity>
                <SpecificHeatCapacityDry>850</SpecificHeatCapacityDry>
                <ThermalConductivityDry>0.1</ThermalConductivityDry>
                <WaterVaporDiffusionResistanceFactor>7.9</WaterVaporDiffusionResistanceFactor>
                <MoistureStorageFunction>
                    <TableValue>
                        <x>0</x>
                        <y>0</y>
                    </TableValue>
                    <TableValue>
                        <x>0.5</x>
                        <y>3.1</y>
                    </TableValue>
                    <TableValue>
                        <x>0.8</x>
                        <y>8.4</y>
                    </TableValue>
                    <TableValue>
                        <x>0.93</x>
                        <y>18</y>
                    </TableValue>
                    <TableValue>
                        <x>0.964</x>
                        <y>116</y>
                    </TableValue>
                    <TableValue>
                        <x>0.99</x>
                        <y>266</y>
                    </TableValue>
                    <TableValue>
                        <x>0.995</x>
                        <y>269</y>
                    </TableValue>
                    <TableValue>
                        <x>0.999</x>
                        <y>277</y>
                    </TableValue>
                    <TableValue>
                        <x>1</x>
                        <y>380</y>
                    </TableValue>
                </MoistureStorageFunction>
                <LiquidTransportationCoefficientSuction>
                    <TableValue>
                        <x>0</x>
                        <y>0</y>
                    </TableValue>
                    <TableValue>
                        <x>3.1</x>
                        <y>2e-10</y>
                    </TableValue>
                    <TableValue>
                        <x>38</x>
                        <y>5.4e-09</y>
                    </TableValue>
                    <TableValue>
                        <x>265</x>
                        <y>1.1e-08</y>
                    </TableValue>
                    <TableValue>
                        <x>342</x>
                        <y>2e-08</y>
                    </TableValue>
                    <TableValue>
                        <x>380</x>
                        <y>1e-07</y>
                    </TableValue>
                </LiquidTransportationCoefficientSuction>
                <LiquidTransportationCoefficientRedistribution>
                    <TableValue>
                        <x>0</x>
                        <y>0</y>
                    </TableValue>
                    <TableValue>
                        <x>3.1</x>
                        <y>2e-10</y>
                    </TableValue>
                    <TableValue>
                        <x>38</x>
                        <y>4.2e-10</y>
                    </TableValue>
                    <TableValue>
                        <x>265</x>
                        <y>7.2e-10</y>
                    </TableValue>
                    <TableValue>
                        <x>342</x>
                        <y>4e-09</y>
                    </TableValue>
                    <TableValue>
                        <x>380</x>
                        <y>2.2e-08</y>
                    </TableValue>
                </LiquidTransportationCoefficientRedistribution>
                <ThermalConductivityMoistureDependent>
                    <TableValue>
                        <x>0</x>
                        <y>0.1</y>
                    </TableValue>
                    <TableValue>
                        <x>380</x>
                        <y>0.1</y>
                    </TableValue>
                </ThermalConductivityMoistureDependent>
                <ThermalConductivityTemperatureDependent>
                    <TableValue>
                        <x>10</x>
                        <y>0.1</y>
                    </TableValue>
                </ThermalConductivityTemperatureDependent>
            </HygroThermal>
            <Optical>
                <Integrated>
                    <Infrared>
                        <Transmittance>0</Transmittance>
                        <Emissivity-Front>0.9</Emissivity-Front>